{
  "before_fingerprint": "sha256:0000000000000000000000000000000000000000000000000000000000000000",
  "candidate_fingerprint": "sha256:0000000000000000000000000000000000000000000000000000000000000000",
  "changed_paths": [
    "src/lib.rs"
  ],
  "contract_version": 0,
  "coverage_fingerprint": "sha256:0000000000000000000000000000000000000000000000000000000000000000",
  "expected_after_fingerprint": "sha256:0000000000000000000000000000000000000000000000000000000000000000",
  "fixed_adapter_fingerprint": "sha256:0000000000000000000000000000000000000000000000000000000000000000",
  "patch_fingerprint": "sha256:0000000000000000000000000000000000000000000000000000000000000000",
  "patch_set_id": "pat_00000000000000000000000000",
  "pipeline_ref": "fixture",
  "policy_fingerprint": "sha256:0000000000000000000000000000000000000000000000000000000000000000",
  "pre_gate_fingerprint": "sha256:0000000000000000000000000000000000000000000000000000000000000000",
  "pre_gate_id": "fixture",
  "pre_gate_revision": 0,
  "profile_ref": "fixture",
  "project_id": "prj_00000000000000000000000000",
  "request_fingerprint": "sha256:0000000000000000000000000000000000000000000000000000000000000000",
  "schema_id": "star.rust-style-policy-approval-request",
  "schema_version": 1,
  "scope_paths": [
    "src/lib.rs"
  ],
  "standing_grant_fingerprint": "sha256:0000000000000000000000000000000000000000000000000000000000000000",
  "toolchain_fingerprint": "sha256:0000000000000000000000000000000000000000000000000000000000000000"
}